Number;Speaker;Start time;End time;Duration;Text
73;Speaker 1;00:35:57.730;00:36:54.340;00:00:56.610;"Like actually I use GPT-3, I have an account there so I could write a prompt and just give me ten ideas of cat toys. And then you would write number one like cat and two and then another stupid idea and then you would right after you gave this prompt another prompt and then it would auto to complete this. Then we would run it a few times. I did that with the official opener. Igpt three, but also there is a worse one from hugging face, but that one doesn't work, didn't work. The only one that works a bit more. But then what was the other one you asked for?"
74;Speaker 2;00:36:54.480;00:37:17.810;00:00:23.330;"Yes. Do you think you can use AI to brainstorm the insights after you go through the quality data? And when you are trying to come up with solutions for the US problems, do you think you can brainstorm the ideas with AI like you did with question generation?"
75;Speaker 1;00:37:25.670;00:38:17.060;00:00:51.390;"I don't think it's there yet, but I could see it in the future. Sometimes when you're stuck, it can give you good ideas. I think for ideas like right now pretty much all I know AI does is expand text or shrink text. That's what I think about AI now, mostly if we talk about this, I think mostly about it enlarging short snippets of text, getting more ideas, giving more inspiration or summarizing interview insights. And for summarizing, I think I can see it work. But to make a leap and go from looking at the data and summarizing it to then creating ideas for solving UX problems. I don't think so, no."
76;Speaker 2;00:38:17.200;00:38:44.610;00:00:27.410;"Okay. Then you mentioned summarizing and you mentioned that when the AI summarize the UX data, then for example, when it's about parking, then it might just highlight parking as the main topic for that UX data, then it's not that helpful. Then what kind of summarisation do you want to get from AI?"
77;Speaker 1;00:38:48.570;00:39:10.320;00:00:21.750;"So the last one I see like really helpful summaries where I've seen on Twitter thread of AI summarizing actual research papers in the style that the five year old can read it. That was really fun. Sometimes really accurate. Something like that. I could see."
78;Speaker 2;00:39:10.650;00:39:14.940;00:00:04.290;"Can you share the like Twitter ready to find one?"
79;Speaker 1;00:39:15.390;00:39:16.860;00:00:01.470;"I will look for it."
80;Speaker 2;00:39:17.490;00:39:18.720;00:00:01.230;"Thank you. Okay."
81;Speaker 1;00:39:33.250;00:39:45.200;00:00:11.950;"I don't have the Twitter set, but I think I found this article. Oh, there it is. I put it here in the chat."
82;Speaker 2;00:39:45.350;00:39:46.060;00:00:00.710;"Okay."
83;Speaker 1;00:39:55.370;00:40:46.360;00:00:50.990;"Thank you. Yeah, that was fun. I don't know if any of these tools I have. What was it called? Yeah, like Dovetail, for instance, one like that, which we looked at but never used because it was cloud hosted, I think. But there are a few others like it that we were at least discussing in the UX Research Department circle, if we can make any use of it. Okay."
84;Speaker 2;00:40:59.390;00:41:11.490;00:00:12.100;"I have another question. Do you think it will be useful to get helped by AI and or additional human assistance in a working environment?"
85;Speaker 1;00:41:21.250;00:42:41.570;00:01:20.320;"Yes. But I must also say we were in kind of a luxurious environment for a while where my Department had more money than they could spend. So I told you earlier about these agencies which we would hire and they would do research for us, but we didn't do it. So we would have had money to pay a researcher to do research for us, but we didn't because we were thinking something else at the time is more important. So sometimes we felt like we are almost forced to do research, even though we don't think that's what is needed the most because my project group itself was more and more that really was makers who wanted to build things. So we always would want to do small research and then build something. But yeah, it really depends on the project, to be honest. So sometimes the other project in the end, which was more on the operating system there, I would definitely want to have 100 interns helping to organize this database."
86;Speaker 2;00:42:42.070;00:42:46.190;00:00:04.120;"I see. It depends on projects."
87;Speaker 1;00:42:46.930;00:43:30.520;00:00:43.590;"Yeah. And if there is something you can if there's something you can describe to an intern to be done or easily can hand over, then it's helpful. But often, actually, even with this luxurious situation where we would have money to hire a company which is a professional UX research agency, to do the research fast, I had the situation that I failed. It takes longer to describe. Right. The project plan and if I would just be able to hire the participants and then do it myself. Sometimes describing problem can take longer than."
88;Speaker 2;00:43:31.270;00:43:38.290;00:00:07.020;"Right. Thank you for sharing your experience. It really helped me a lot."
89;Speaker 1;00:43:38.450;00:44:01.590;00:00:23.140;"I hope so, yes. If you have more questions, come back to me anytime. It was interesting. I mean, it was an interesting experience because in the company I was before doing internship, UX was completely different at UX Research, but we were in the special Department with a very powerful boss. So it was kind of a unique experience."
90;Speaker 2;00:44:01.710;00:44:13.310;00:00:11.600;"Yeah, I think it's definitely a unique experience, especially because like an automobile company. So maybe that's why it's unique."
91;Speaker 1;00:44:15.610;00:45:06.040;00:00:50.430;"But was also very difficult. Always was the hardware dependency and the long development cycle. So often we would build these prototypes based on user needs, which were very close to what we think the user wants. And then we would show it to the development Department and they say, yeah, we can't do this because of that. And this all is too difficult. So in the automotive industry, often the disconnect between the vision and the reality, the capabilities of what a company can achieve is a bigger concern than the gap between knowing what the people want and showing that. Do you understand me?"
92;Speaker 2;00:45:06.120;00:45:06.760;00:00:00.640;"Yes."
93;Speaker 1;00:45:07.450;00:45:13.720;00:00:06.270;"I think we had more of a production difficulty than like our UX research was great."
94;Speaker 2;00:45:18.350;00:46:36.040;00:01:17.690;"That's interesting because I had an interview with my friend who's working at Google and she said she's a UI designer, so she's not working as a UX researchers per se. But she told me that it's difficult to work as a UI designer because UX researchers just throw a bunch of new, interesting ideas instead of just narrowing down their ideas to one solution. Because if you're a developer or UI designer, they want to build a solid prototype, not like making ten kinds of prototypes and then discuss about it. So she said being a UX researcher would be so stressful in that environment because everyone wants an answer, but their job is naturally just to come up with interesting insights and not just providing a solution. So I think it's interesting that you say you really enjoyed UX research, like doing UX research at your company."
95;Speaker 1;00:46:42.350;00:47:06.850;00:00:24.500;"The thing is that we didn't have to build something that goes fully on the road, but we would be like more the pre production and then the insights that you find most valuable are the ones that you can choose. But I guess in Google you have always large system that has to go into production soon. It complicates things."
96;Speaker 2;00:47:07.030;00:47:07.760;00:00:00.730;"Yeah."
97;Speaker 1;00:47:08.270;00:48:35.170;00:01:26.900;"But also one problem, actually, one really big cubics research problem I always felt was this negotiating amongst different interests. So often when you couldn't say objectively what would be a better solution or a higher priority, let's say some people prefer safety and some prefer Privacy. I'm thinking about that because that's also what my research is about currently. I quoted that before. It's difficult to say what has more value. And then people would look to the UX researcher and ask them to give an answer. Yes, but often they cannot. Because what you find is that there are just different values and ideologies and then every user has a different degree of prioritizing those. And then the only thing to answer this often would be like to go to marketing and say our customer base are very Privacy focus consumers. If we want to speak to our old customers, we will make a solution that is very Privacy where but then you don't know, should we actually go more to digital natives who want more AI features? Then you would have a different thing. So often the USB search was also a bit influenced, I think by marketing."
98;Speaker 1;00:48:35.230;00:48:50.480;00:00:15.250;"Like what customer group is more important right now, specifically the car industry. Obviously you often focus for the high value customers. So that would also drive your research a lot."
99;Speaker 2;00:48:51.830;00:48:57.510;00:00:05.680;"I see. Who are the high value customers in automobile industry."
100;Speaker 1;00:48:58.190;00:50:15.680;00:01:17.490;"So with Forks Fargo, you have very few young people, at least in Europe and we wanted to drive it closer to digital natives. But prime customers in Europe are all around 50 men. And also in car, you have to distinguish, we have found in UX research, actually one thing which is that cars currently really under deliver to families and to family needs and children needs. But the problem is the person who buys the car is not the user. So the customer is not the user. The driver decides, the driver decides about the features. And if the man who buys the car is head of the family, wants a big SUV that looks cool, has a lot of value, often would prioritize his own needs above these of others. And then in research we would also probably do this sometimes, or at least not we would do. But product measures would drive us more to not putting too many children features in there because I don't know, that's a bit of oversimplification now, but there always was also a bit of this."
101;Speaker 2;00:50:17.510;00:50:25.310;00:00:07.800;"Yeah, I do a lot. Can I come back to you and I come up with more questions after?"
102;Speaker 1;00:50:25.410;00:50:33.250;00:00:07.840;"Yeah, sure. Sorry if I talk confusing because I'm quite late already, but happy to help you."
103;Speaker 2;00:50:33.370;00:50:38.310;00:00:04.940;"Yeah. Thank you so much. Especially when it's too late."
104;Speaker 1;00:50:39.290;00:50:46.890;00:00:07.600;"No problem. One thing I want to ask, do you still have time to take Pinot on the weekend?"
105;Speaker 2;00:50:47.000;00:50:47.840;00:00:00.840;"Of course."
106;Speaker 1;00:50:48.890;00:50:49.470;00:00:00.580;"Okay."
107;Speaker 2;00:50:49.580;00:50:52.970;00:00:03.390;"Where are you guys going? Are you guys going to like, New York City?"
108;Speaker 1;00:50:53.130;00:51:03.450;00:00:10.320;"Yeah, to New York City. We book concert tickets for Friday evening and for Sunday we will go to spa spa."
109;Speaker 2;00:51:03.770;00:51:08.960;00:00:05.190;"Like bathing type of spa. Oh my God. That's awesome."
110;Speaker 1;00:51:11.970;00:51:18.670;00:00:06.700;"We found Valentine's. Was it Valentine's or spring discount in new Jersey?"
111;Speaker 2;00:51:20.250;00:51:21.300;00:00:01.050;"That's awesome."
112;Speaker 1;00:51:22.470;00:51:28.030;00:00:05.560;"It was not Korean. I think it was a Korean spa."
113;Speaker 2;00:51:28.140;00:51:32.700;00:00:04.560;"Okay, please go to Korean spa and tell me how was that?"
114;Speaker 1;00:51:34.990;00:51:38.840;00:00:03.850;"Yeah, I think it was a Korean."
115;Speaker 2;00:51:38.930;00:51:41.560;00:00:02.630;"Okay, if it's good, I wanted visit there too."
116;Speaker 1;00:51:42.070;00:51:45.010;00:00:02.940;"Okay, then. Good night."
117;Speaker 2;00:51:45.170;00:51:52.700;00:00:07.530;"Okay. Good night. Okay. Yeah. I can definitely take Pina during this weekend and Goodnight. Thank you so much. Bye."
