Number;Speaker;Start time;End time;Duration;Text
0;Speaker 2;00:01:28.150;00:01:29.190;00:00:01.040;"Hi, Dylan."
1;Speaker 1;00:01:32.670;00:01:33.600;00:00:00.930;"Hear you."
2;Speaker 2;00:01:35.310;00:01:50.220;00:00:14.910;"Okay. Actually, I'll look to my AirPod. Give me a second. I think it's not working. So I would just do it."
3;Speaker 1;00:01:50.420;00:01:50.740;00:00:00.320;"Okay."
4;Speaker 2;00:01:50.760;00:01:52.650;00:00:01.890;"So you hear me fine, right?"
5;Speaker 1;00:01:52.830;00:01:54.570;00:00:01.740;"I hear you fine. Yes. Perfect. Perfect."
6;Speaker 2;00:01:54.690;00:02:28.720;00:00:34.030;"Great. Thank you for participating this pilot study and let me get started. Sure. Hi, I'm Daikai. I'm a main researcher for this project. Before we start, I would like to read the content form and by saying yes, you voluntarily agreed to participate in this interview. So let me read the consent form. Actually, I will skip this part. And can you say yes?"
7;Speaker 1;00:02:29.230;00:02:35.170;00:00:05.940;"Yes, I will agree to being participant in this interview and you can record my audio and transcribe it."
8;Speaker 2;00:02:35.270;00:02:47.330;00:00:12.060;"Thank you. And I will ask questions from now on. Can you tell me about your role as a UX researcher at the company when you're working as a UX researcher?"
9;Speaker 1;00:02:47.890;00:04:09.910;00:01:22.020;"Yeah, I was working before for three years in the folks on Group Future Center in Potsdam. It's called Foxang Group Future Center Europe and it's part of the Fox Baron group. So we were doing user experience design for all the folks brands, like obviously folks Audi, Porsche, others. And I was part of the experience design team and as part of the user experience design team, my role was called UX technologist. We had UX technologists, UX researchers, UX designers, and in those roles we had a kind of flat hierarchy design like our boss tried to establish a new way to run companies. So we had people that could be part of circles. And I was also part of the UX researcher circle. So while I did many coding and only a little bit of design, I also majorly did research as part of my job there."
10;Speaker 2;00:04:10.080;00:04:23.580;00:00:13.500;"I see. Then as a UX technologist, did you conduct any user study? Did you interview users and analyze qualitative data?"
11;Speaker 1;00:04:24.630;00:05:02.170;00:00:37.540;"Yeah. So whenever we had a new project, we usually would go with the traditional human centric process. Sometimes we try to deviate from it a little bit when we felt like it's not necessary. But there was almost every project user research involved and often I was organizing that also majorly because in my groups we actually never had another user experience researcher, so we didn't have one whose main job was doing research. So I was doing this with my project team colleagues."
12;Speaker 2;00:05:02.490;00:05:12.580;00:00:10.090;"I see. How many other UX researchers did you collaborate with?"
13;Speaker 1;00:05:15.370;00:06:16.260;00:01:00.890;"Across my time, research circle had four permanent members and one Cross member and another Cross member like me. Okay. But we were also working with many other user experience researcher from Carriet and from Karmic, which are other folks buying subsidies. They had their own whole UX Department as well. So we work a lot with them. Also. They have we share services, which are the digital services. And actually with them we could do most of our research very easily. So that was what I actually used most because they set up so called we listen regular appointments and we would just use their participants to do our research."
14;Speaker 2;00:06:17.190;00:06:18.120;00:00:00.930;"I see."
15;Speaker 1;00:06:19.950;00:06:21.050;00:00:01.100;"2030."
16;Speaker 2;00:06:21.060;00:06:25.620;00:00:04.560;"I see. Wow, that's a big group."
17;Speaker 1;00:06:26.130;00:06:28.930;00:00:02.800;"Yeah, it's many. We work quite well connected."
18;Speaker 2;00:06:31.690;00:06:36.280;00:00:04.590;"How often did you analyze qualitative data?"
19;Speaker 1;00:06:38.230;00:07:21.380;00:00:43.150;"So as part of the research, I try to keep it brief. I know it often takes long, but one thing that was problematic Besides, do we listen? What? I just mentioned this format often. We were not allowed for legal reasons to do the user research on our own. So we would also hire agencies and then these digital agencies would do the research and the analysis of the data on our behalf because for GDPR like data protections reasons, our company did not want to handle the data themselves."
20;Speaker 2;00:07:21.830;00:07:22.520;00:00:00.690;"I see."
21;Speaker 1;00:07:22.600;00:08:02.010;00:00:39.410;"So fortunately, it's quite bureaucratic interesting. That's why we set it up with other people so often. I would have a second research. So if it's not small research, but bigger research where we would look into a prototype we've built over a long time, we would also hire agency and then they would decide on what methods to do with us, but most importantly, they would transcribe the data and either give us the interviews, but often even do a report in form of a PowerPoint."
22;Speaker 2;00:08:04.950;00:08:28.150;00:00:23.200;"Then you didn't really have to transcribe interview data and then do coding to come up with insights from the qualitative data. Instead, you guys hired other agencies to do that for you guys often, but not always."
23;Speaker 1;00:08:28.260;00:08:53.470;00:00:25.210;"For this we listen format. For instance, we were not allowed to do video recordings and also not allowed to do voice recordings, but we would do notes. So often we would sit together with multiple people. So I would take a colleague of mine and then do notes while we interview and while we show our prototypes."
24;Speaker 2;00:08:54.570;00:09:11.510;00:00:16.940;"I see. Okay. And how is the qualitative data incorporated into the product? Do you think it's well incorporated or do you find any?"
25;Speaker 1;00:09:11.560;00:10:46.420;00:01:34.860;"That's a very difficult question. It's complicated. I think we were really struggling because I think it's not so much about qualitative data, but it was really a lot more about the organizational structure of the company because it's so big. We didn't even really know where you exit would be positioned and they would set up actually while we were there a new way to organize the company, at least the digital parts of it. So they have a new subsidy called Carrier. And this company would be set up with a safe it's called scale framework. I actually had a few trainings on it as well. And in this system, it's a way to describe how and where requirements and epics and definitions would go in. It's pretty much like project planning and there even UX was not really well positioned. So we would always fight for position, but in theory, we would have a lot of user experience, research findings, all across the company, probably spread out in some PowerPoint documents, and then it would be a lot about knowing people and connecting with them and sharing the results."
26;No speaker;00:10:46.510;00:10:46.900;00:00:00.390;"Okay."
27;Speaker 1;00:10:46.980;00:11:26.320;00:00:39.340;"So that would be one, like, lose PowerPoint reports. Another one would be if we have built actual prototypes, then these protests often come with documentation, but then the UX research would be part of the prototype. Yeah. So actually there's even, like, different ideologies on how UX research should be incorporated into product. So some would do it more in terms of the data and the findings and then have those well communicated and bring these over to production teams."
28;Speaker 2;00:11:26.470;00:11:27.060;00:00:00.590;"Yes."
29;Speaker 1;00:11:27.200;00:12:14.740;00:00:47.540;"Or the other one is that what really was my boss's vision more is that actually all project teams have researchers in that team. And then if these teams would do the research on their own, they would actually empathize with the end users while designing the product. So the research knowledge wouldn't be so much on sheets and documents, but it would be more implicit knowledge that the team members have. So the idea of hers was more that if people interact with end users, empathize with them, with their needs, with their values, that they would make better designed products."
30;Speaker 2;00:12:16.090;00:12:44.120;00:00:28.030;"Interesting. Thank you. How fast was the project cycle when you're conducting politics data analysis? Did you feel like time pressured? So did you have not enough time to go over that data thoroughly, then just like, skimmed it and just try to apply it easily, or how is it?"
31;Speaker 1;00:12:44.570;00:14:01.480;00:01:16.910;"I think there's definitely a problem in terms of that's. One problem of these crossfunctional teams, I've said a lot is that if you are a team member, like, if you are with team members from different skills and backgrounds and you try to work together, that can be very exciting and you learn a lot about others. But often the pure research, not like me, but the pure research would have times where they don't have anything to do and others would just be bought and hang out and wait for the results, and then they would have a lot of time pressure to deliver results. Or when I would do the research, I would often also try to be very quick with it because I want to start working on something, and then I would really run over the try to do it as rough and quick and dirty as possible so that we can start working on coding and building prototypes, because I know that that would also be my role. So that would be quite different. So I think because I have this dual role, it would be very different."
32;No speaker;00:14:01.680;00:14:02.420;00:00:00.740;"Okay."
33;Speaker 1;00:14:03.650;00:16:17.790;00:02:14.140;"Also, one thing I really noticed is that in terms of project outcomes, it really depends on who we were. Almost like a small agency. So it really depends on who comes in, who values what. So often, if we have more engineers coming in as our clients, let's say they would be more interested in functional prototypes, something they can explore, something can see. And then if we had other clients more from the newly for product management, let's say they would only be interested in findings in Qualitative research. Findings actually in the end the company really drifted a lot to these findings documentation, database. One of the reasons why I didn't want to stay there was because the Department of UX, they have a lot of human factors people and they were really so we got now the money from a different boss and these new bosses would care a lot about having a backlog of UX findings in a database. And we would for weeks and weeks just this backlog in a Gyra database. And Gyra is like a coding website, like a code tracker, let's say a back tracker. It's a bug tracker. And we would have a system to document user needs together with evidence from research and would investigate what customer needs are more important because they are setting up a new company which has to build a lot of things because they make a new operating system for cars."
34;Speaker 1;00:16:19.190;00:17:02.660;00:00:43.470;"And this new operating system needs really well prioritized functions and definitions of features. So we would for multiple months just prioritize what the user needs are in this backlog together with qualitative and quantitative findings. And then I'll link it many complex web pages. So my work really is very different. I've done very different focus of UX Qualitative data research. So it's not like we had one process and followed it throughout the time I was there. It really changed a lot."
35;Speaker 2;00:17:04.190;00:17:28.490;00:00:24.300;"Very interesting. I think you already mentioned a bit about this again, I will skip to the next part. What was the problem that you needed to solve using qualitative data analysis?"
36;Speaker 1;00:17:34.070;00:19:08.430;00:01:34.360;"Okay, so the one I mentioned last, it was about pretty much prioritizing development. So deciding which features should be built first, what does the user care about most, but also anticipating what will customers need in the long run. And then we would write very complicated visions of the future and based upon this vision we would sort of stress test what the new operating operating system needs to be capable to do because they are setting the system software architecture up now and it should support because the development will take many, many years. It should support pretty much anything we envision in many years as well. So this would be one thing where we did quality research just because it's very time consuming to do quantity research for that we did also a few service. So I also have to say we did mixed methods. So we also did service where we interviewed multiple customer markets but it was also based on interviews. I see the other one would be more these agencies style design project, Sprints, let's say where we would look into like we were working a lot on self driving cars, autonomous cars. And because there's not much knowledge in the company on the needs of elderly, of visually impaired, of wheelchair users."
37;Speaker 1;00:19:09.050;00:19:27.920;00:00:18.870;"We had a lot of design sprints where we needed to re get into complete new customer groups and then we would use this to brainstorm or develop and also to build in the way of the human centered design process."
38;Speaker 2;00:19:28.370;00:19:47.900;00:00:19.530;"I see. Okay. You mentioned before that you felt pressured reporting a research to other team members, for example, like developers, because they need to code something. While if you don't give the resort they have to wait."
39;Speaker 1;00:19:49.430;00:19:52.280;00:00:02.850;"Well, they will start and just do anything."
40;Speaker 2;00:19:53.090;00:20:06.630;00:00:13.540;"I see. So does that type of collaboration environment hindered you from conducting qualitative data analysis thoroughly?"
41;Speaker 1;00:20:16.650;00:20:44.100;00:00:27.450;"Yes, let's not speak negatively of UX research, but because I was in this dual role and we didn't have many developers, I just saw that their need is more and my contribution would be higher if I spent more time on the coding part than on the research part. So it was often on that."
42;Speaker 2;00:20:44.240;00:20:46.200;00:00:01.960;"I see. Okay."
43;Speaker 1;00:20:47.850;00:20:55.500;00:00:07.650;"But yes, it could have been more thorough. I agree."
44;Speaker 2;00:20:57.330;00:21:15.880;00:00:18.550;"Okay. When you are conducting qualitative data analysis, how did you find induced insights from data? How did you develop new ideas to solve UX problems?"
45;Speaker 1;00:21:18.130;00:22:03.690;00:00:45.560;"So in terms of methods, you mean like affinity diagrams, just traditional coding of insights reports. Often what we sometimes even did, which was really cool, was this type of video reports where you would film people, you interview and then make a whole documentation about the whole process. You would meet with people, first interview them on video, then build something and then later while they explore your prototype, film them again and see their reaction."
46;Speaker 2;00:22:04.430;00:22:20.850;00:00:16.420;"Interesting. Then did you collaborate with other US researchers a lot or did you like read your data alone and just come up with ideas?"
47;Speaker 1;00:22:22.370;00:22:42.140;00:00:19.770;"So both in the beginning it was more separated in teams and then later there was a lot of collaboration with many researchers. I would even meet with them in the offices and discuss the research findings. The user needs database we have set up."
48;Speaker 2;00:22:45.390;00:22:46.140;00:00:00.750;"Okay."
49;Speaker 1;00:22:49.030;00:24:48.820;00:01:59.790;"One thing we didn't have was sent like no one was really happy with the system we have because it wasn't this Jira database and it was very time consuming to link findings with each other and tickets and there was many duplicates and it felt like a growing database of many needs and it would feel unmanageable at a time. And often we would go through these findings and have them linked back to the original research and depending on how you formulate your findings. So with qualitative research, because you try to summarize complex findings into simpler words, often it becomes at some time also interpretation. And then we would fight a lot. We would sit with people in rooms and discuss for minutes and hours what the exact user needs behind something is because also when we have multiple users who say they want to have fast navigation system with the radio. I have a hard time to mention something though. Okay. Let's say they would want a car where they can watch movies on the road. Then this is a feature, but we would try to document the actual user needs and not just feature requests. So we would try to look at the higher needs and the drive behind the users because we wouldn't just like the idea of research and UX is not just to document actually what people say they want, but to have findings that then actually lead to new insights."
50;Speaker 1;00:24:48.850;00:24:51.540;00:00:02.690;"So we would really discuss a lot about this."
51;Speaker 2;00:24:54.310;00:25:29.320;00:00:35.010;"Okay. Thank you. To explain this part. Okay. Did you also have to collaborate with other team members who are not UX researchers? How is it different from collaborating with UX related people?"
52;Speaker 1;00:25:30.010;00:26:12.080;00:00:42.070;"Many personal I can't summarize it too much to I can't really summarize it to the skill or the occupation of the people, but it felt that it's more dependent on the personality. So some people are very good and they would take a lot of effort and be very helpful. They would come up with interesting interview questions, but often let's think about a few individuals. They would have hard time to find anything valuable and they would not see the benefit and could not really contribute to doing UX research."
53;Speaker 2;00:26:17.070;00:26:17.630;00:00:00.560;"Why do you."
54;Speaker 1;00:26:17.630;00:26:20.450;00:00:02.820;"Oh, was that what you meant? Was that what you asked?"
55;Speaker 2;00:26:20.630;00:26:32.100;00:00:11.470;"Yeah, but why do you think some people don't see the value of UX research and cannot find interesting insights from the user study data?"
56;Speaker 1;00:26:33.390;00:27:00.250;00:00:26.860;"I think a lot of disagreement would also be in what is a novel insight and when like basic interview differences where maybe a trained UX researcher would ask a few more indepth questions and people who are not trained would just look at very shallow insights and not ask more in depth."
57;Speaker 2;00:27:03.430;00:27:28.290;00:00:24.860;"So there are some people who just look into like shallow answers and ask shallow questions, not ask indepth questions. Yeah, I see. Then if you can have any type of support for finding insights from qualitative data, what support would you want to receive."
58;Speaker 1;00:27:29.990;00:27:31.880;00:00:01.890;"From people or from."
59;Speaker 2;00:27:32.630;00:27:39.680;00:00:07.050;"I think anything can be possible. You can imagine anything you want."
60;Speaker 1;00:27:41.610;00:28:40.620;00:00:59.010;"I know there are some really cool new software platforms that automatically transcribe and document and then you have a searchable database. And to have a searchable database would be really exciting where you can go and jump back to the original interviews and see it again like a centralized database, which is what we try to build in some degrees. But we couldn't use any of these new startups. I don't know what they are called. There are some startups that offer like new types of online based UX research. Finding online databases, something like that would be really cool but like a company like Volkswagen couldn't use it due to GDPR problems, supplier problems."
61;Speaker 2;00:28:41.010;00:28:41.940;00:00:00.930;"I see."
62;Speaker 1;00:28:42.810;00:28:52.800;00:00:09.990;"Like the it buying process in these car automotive industries is very complex. So we couldn't just use whatever we want to use."
63;Speaker 2;00:28:52.940;00:29:19.630;00:00:26.690;"I see. Why do you think having an online database that can link to the source is important to finding insights from qualitative data other than it helps us researchers to organize it better? Do you think it will help to come up with more novel ideas or interesting solutions?"
64;Speaker 1;00:29:21.330;00:30:26.330;00:01:05.000;"Yeah, I think it's really empathizing with the original interviewees can help a lot. There is a difference. If you write on a sheet of paper that user life can drastically be improved by a ramp in the car. Whereas when you see someone enthusiastically expressing themselves, being heard the first time and being acknowledged for the lack of needs in the regards of cars. So I think there's a huge difference. I almost think that's why I mean, that's also what many people try to be more interdisciplinary. There is something lost if you just present summarized findings rather than interacting with the original material."
65;Speaker 2;00:30:28.270;00:30:44.270;00:00:16.000;"I see. Thanks. Okay then if there is a human assistance, how would you like them to help you maximize the efficiency of finding insights from qualitative data and improve the quality of insights?"
66;Speaker 1;00:30:47.450;00:32:34.880;00:01:47.430;"So one thing I noticed honestly now a bit of a Contra argument, counter argument to what I said before. It gets difficult. The more and more you hear the same things. So if you do interviews on what stresses people in parking situations get bored after having heard of the 10th time, and then you stop being there and stop asking deeper and deeper questions and be like, yeah, okay, he doesn't like being stuck in parking lots. It's okay. But you would probably have to dig deeper and it gets tiresome. So I would like to have some assistance doing these interviews with multiple participants. But yeah, I don't think a digital assistant can do it yet. If you have to fake genuine interest, there's a reason why face to face interviews are better than like online service. It's because if the interviewers care about learning something, you get better insights. And if you would automate it with a chatbot, you would use that. So that's why often if you really care about finding something out and knowing someone's opinion and their drives and motives, your findings will be much better than when you're uninterested. But the more you interview people, the more you professionalized and the less interested you become."
67;Speaker 1;00:32:35.870;00:32:43.350;00:00:07.480;"I don't know. On the other hand, psychologists probably also can get some real insights from people. So there are some methods."
68;Speaker 2;00:32:43.730;00:33:05.820;00:00:22.090;"I see. Okay then if you can get an assistant from AI. Wait a second. If you can use AI in your work to improve the quality and quantity of insights derived from qualitative data, what do you expect AI to do to help you?"
69;Speaker 1;00:33:09.070;00:34:12.630;00:01:03.560;"So I think what AI can do a lot better than previous technologies. If you looked at previous technologies that tried to summarize findings. The most exciting thing you would probably get from automated coding tools is get like a network plot which shows which words were mentioned more, but that often looks cool on a page but don't really help you in day to day work. If your interview was about being stressed finding parking space, and then the software just shows parking space very huge inside. But I think these AI tools are getting a lot better with abstracting complex knowledge into shorter summaries. And I would really be interested to see where that could go. If now they could find generalized findings from many data points, that could be very helpful."
70;Speaker 2;00:34:15.030;00:34:47.260;00:00:32.230;"I see. Do you think AI can be used to ask more deeper questions? Like you said, human researchers tend to get bored when they ask same questions like for ten times and then do you think like AI can detect that and then promote more interesting questions when the researcher keeps asking similar questions that are very small?"
71;Speaker 1;00:34:48.130;00:35:41.310;00:00:53.180;"Actually could see two things, both an AI watching me and telling me, oh, your attention is going away from interviewing. Pay attention to the thorough. Like a reminder, almost like I don't know, like automated mood recognition system. But the other one to help brainstorming new questions probably could also be possible. Actually once tried AI tools for brainstorming, which is not writing qualitative interview questions, obviously. But I did that a few times. And if you spend a lot of time occasionally something funny, challenging when you can come out. So I could also see AI being helpful for question generation."
72;Speaker 2;00:35:41.810;00:35:57.670;00:00:15.860;"Okay then can you share me like the software that you use for the brainstorming to generate questions? And also you said you use AI to brainstorm?"
